华夏上证50ETF基金,510050
易方达深证100ETF,159901
华泰柏瑞上证红利ETF基金,510880
工银瑞信上证中央企业50ETF基金,510060
交银施罗德180公司治理ETF基金,510010
博时上证超级大盘ETF基金,510020
易方达上证中盘ETF基金,510130
华宝兴业上证180成长ETF基金,510280
华宝兴业上证180价值ETF基金,510030
鹏华上证民企50ETF基金,510070
南方小康产业ETF基金,510160
海富通上证周期行业50ETF基金,510110
工银瑞信深证红利ETF基金,159905
华安上证龙头企业ETF基金,510190
国联安上证大宗商品ETF基金,510170
招商上证消费80ETF基金,510150
大成深证成长40ETF基金,159906
华泰柏瑞上证中小盘ETF基金,510220
富国上证综指ETF基金,510210
富国上证综指ETF指数基金,510213
国泰上证180金融ETF基金,510230
诺安上证新兴产业ETF基金,510260
海富通上证非周期ETF基金,510120
广发中小板300ETF基金,159907
博时深证基本面200ETF基金,159908
中银上证国有企业100ETF基金,510270
招商深证TMT50ETF基金,159909
嘉实深证基本面120ETF基金,159910
鹏华深证民营ETF基金,159911
建信深证基本面60ETF基金,159916
汇添富深证300ETF基金,159912
南方上证380ETF基金,510290
易方达创业板ETF基金,159915
交银施罗德深证300价值ETF基金,159913
国泰中小板300成长ETF基金,159917
国泰中小板300成长ETF联接基金,20025
嘉实中创400ETF基金,159918
博时上证自然资源ETF基金,510410
华泰柏瑞沪深300ETF基金,510300
嘉实沪深300ETF基金,159919
景顺长城上证180等权重ETF基金,510420
华夏恒生ETF基金,159920
大成中证500沪市ETF基金,510440
大成中证500沪市ETF联接基金,90020
